{
  "approvalVersion": "0.1.0",
  "approvalId": "approval_partitions_two_room",
  "partitionPolicy": "cad-shared-partition-policy-v0.1",
  "decision": "approved_as_shared_partition_model",
  "topology": {
    "architecturalTopologyVersion": "0.1.0",
    "architecturalTopologyHash": "sha256:d8be5d08652116e14a7f959adf3efcd80148c7615661d2a7448fce68f74c2f59",
    "candidateBasis": "space_wall_stage",
    "sourceHash": "sha256:6de69c56aac4cdc9e98f1a658c62974e4af8e53aff9f19382d352b7143fcab9e",
    "cadDocumentHash": "sha256:7cdd0a8b9d47a74bc57edec6449594d59c4c46682b568c141475f9e84a3aaf29",
    "profileHash": "sha256:120a33f5919cbc03a0c0f7db42f0770cca9645d8bfd4348d8012f269d5b63f39",
    "spaceWallStageHash": "sha256:ab13a1ac0eed9d9deec986e78bb14bbe6b04aa7119467488184a76ac3083a81a",
    "architecturalExtractionHash": null
  },
  "sharedBoundaryReviews": [
    {
      "sharedBoundaryCandidateId": "shared_boundary_0000",
      "referencePolicy": "partition_centerline"
    }
  ],
  "interiorDoorReviews": [
    {
      "topologyOpeningId": "topology_opening_0000",
      "hingeEndpoint": "world_start",
      "swingIntoSpaceCandidateId": "space_candidate_0001"
    }
  ]
}
